
SQL> SELECT Name
  2  FROM Student
  3  WHERE DepartmentID = (
  4      SELECT DepartmentID
  5      FROM Student
  6      WHERE StudentID = 'S101'
  7  );

NAME
--------------------------------------------------
Amit Kumar
Ravi Singh

SQL> SELECT Name
  2  FROM Student
  3  WHERE Gender = (
  4      SELECT Gender
  5      FROM Student
  6      WHERE StudentID = 'S102'
  7  );

NAME
--------------------------------------------------
Neha Kumari
Pooja Sharma

SQL> SELECT Name
  2  FROM Student
  3  WHERE DepartmentID = (
  4      SELECT DepartmentID
  5      FROM Student
  6      WHERE StudentID = 'S103'
  7  );

NAME
--------------------------------------------------
Amit Kumar
Ravi Singh

SQL> SELECT Name
  2  FROM Student
  3  WHERE DepartmentID IN (
  4      SELECT DepartmentID
  5      FROM Student
  6      WHERE Gender = 'Female'
  7  );

NAME
--------------------------------------------------
Neha Kumari
Pooja Sharma

SQL> SELECT * FROM Enrollment;
SELECT * FROM Enrollment
              *
ERROR at line 1:
ORA-00942: table or view does not exist


SQL> CREATE TABLE Enrollment (
  2      EnrollmentID CHAR(5),
  3      StudentID CHAR(5),
  4      CourseID CHAR(5)
  5  );

Table created.

SQL> INSERT INTO Enrollment VALUES ('E101', 'S101', 'C101');

1 row created.

SQL> INSERT INTO Enrollment VALUES ('E102', 'S102', 'C102');

1 row created.

SQL> INSERT INTO Enrollment VALUES ('E103', 'S103', 'C101');

1 row created.

SQL> commit;

Commit complete.

SQL> SELECT * FROM Enrollment;

ENROL STUDE COURS
----- ----- -----
E101  S101  C101
E102  S102  C102
E103  S103  C101

SQL> SELECT Name
  2  FROM Student
  3  WHERE StudentID IN (
  4      SELECT StudentID
  5      FROM Enrollment
  6  );

NAME
--------------------------------------------------
Amit Kumar
Neha Kumari
Ravi Singh

SQL> SELECT Name
  2  FROM Student
  3  WHERE StudentID IN (
  4      SELECT StudentID
  5      FROM Enrollment
  6  );

NAME
--------------------------------------------------
Amit Kumar
Neha Kumari
Ravi Singh

SQL> SELECT Name
  2  FROM Student S
  3  WHERE EXISTS (
  4      SELECT 1
  5      FROM Enrollment E
  6      WHERE S.StudentID = E.StudentID
  7  );

NAME
--------------------------------------------------
Amit Kumar
Neha Kumari
Ravi Singh

SQL> SELECT * FROM course;

  COURSEID COURSENAME                                            CREDITS
---------- -------------------------------------------------- ----------
    DEPTID  FACULTYID
---------- ----------
       201 DBMS                                                        4
         1        101

       202 Quantum Physics                                             3
         4        109

       203 Digital Electronic                                          3
         5        103


  COURSEID COURSENAME                                            CREDITS
---------- -------------------------------------------------- ----------
    DEPTID  FACULTYID
---------- ----------
       204 Computer Network                                            3
         7        107

       205 DSA                                                         4
         8        107

       206 Electronic                                                  2
         4        108


  COURSEID COURSENAME                                            CREDITS
---------- -------------------------------------------------- ----------
    DEPTID  FACULTYID
---------- ----------
       207 Operating System                                            4
         1        106

       208 Fluid mechanics                                             4
         4        110

       209 Advanced Hydrology                                          3
         4        110


  COURSEID COURSENAME                                            CREDITS
---------- -------------------------------------------------- ----------
    DEPTID  FACULTYID
---------- ----------
       210 Power System                                                3
         6        103


10 rows selected.

SQL> SELECT CourseName
  2  FROM Course
  3  WHERE Credits > (
  4      SELECT AVG(Credits)
  5      FROM Course
  6  );

COURSENAME
--------------------------------------------------
DBMS
DSA
Operating System
Fluid mechanics

SQL> SELECT *
  2  FROM Student
  3  WHERE TO_NUMBER(SUBSTR(StudentID, 2)) > (
  4      SELECT AVG(TO_NUMBER(SUBSTR(StudentID, 2)))
  5      FROM Student
  6  );

STUDE NAME                                               GENDER     DEPAR
----- -------------------------------------------------- ---------- -----
CONTACT
---------------
S103  Ravi Singh                                         Male       D101
9012345678

S104  Pooja Sharma                                       Female     D103
9988776655


SQL> SELECT DepartmentID
  2  FROM Student
  3  GROUP BY DepartmentID
  4  HAVING COUNT(*) > (
  5      SELECT AVG(cnt)
  6      FROM (
  7          SELECT COUNT(*) AS cnt
  8          FROM Student
  9          GROUP BY DepartmentID
 10      )
 11  );

DEPAR
-----
D101

SQL> SELECT Name
  2  FROM Student
  3  WHERE StudentID IN (
  4      SELECT StudentID
  5      FROM Enrollment
  6  );

NAME
--------------------------------------------------
Amit Kumar
Neha Kumari
Ravi Singh

SQL> SELECT Name
  2  FROM Student
  3  WHERE DepartmentID IS NOT NULL;

NAME
--------------------------------------------------
Amit Kumar
Neha Kumari
Ravi Singh
Pooja Sharma

SQL> SELECT CourseName
  2  FROM Course
  3  WHERE CourseID IN (
  4      SELECT CourseID
  5      FROM Enrollment
  6  );
    SELECT CourseID
           *
ERROR at line 4:
ORA-01722: invalid number


SQL> UPDATE Enrollment SET CourseID = '201' WHERE CourseID = 'C101';

2 rows updated.

SQL> UPDATE Enrollment SET CourseID = '202' WHERE CourseID = 'C102';

1 row updated.

SQL> COMMIT;

Commit complete.

SQL> SELECT CourseName
  2  FROM Course
  3  WHERE CourseID IN (
  4      SELECT CourseID
  5      FROM Enrollment
  6  );

COURSENAME
--------------------------------------------------
DBMS
Quantum Physics

SQL> SELECT CourseName
  2  FROM Course
  3  WHERE Credits = (
  4      SELECT MAX(Credits)
  5      FROM Course
  6  );

COURSENAME
--------------------------------------------------
DBMS
DSA
Operating System
Fluid mechanics

SQL>
SQL> SELECT StudentID
  2  FROM Enrollment
  3  GROUP BY StudentID
  4  HAVING COUNT(*) > 1;

no rows selected

SQL> INSERT INTO Enrollment VALUES ('E104', 'S101', '203');

1 row created.

SQL> INSERT INTO Enrollment VALUES ('E105', 'S101', '204');

1 row created.

SQL> COMMIT;

Commit complete.

SQL> SELECT StudentID
  2  FROM Enrollment
  3  GROUP BY StudentID
  4  HAVING COUNT(*) > 1;

STUDE
-----
S101

SQL> SELECT Name
  2  FROM Student
  3  WHERE StudentID IN (
  4      SELECT StudentID
  5      FROM Enrollment
  6      GROUP BY StudentID
  7      HAVING COUNT(*) > 1
  8  );

NAME
--------------------------------------------------
Amit Kumar

SQL> SELECT CourseName
  2  FROM Course
  3  WHERE Credits = (
  4      SELECT MAX(Credits)
  5      FROM Course
  6  );

COURSENAME
--------------------------------------------------
DBMS
DSA
Operating System
Fluid mechanics

SQL> SELECT DepartmentID
  2  FROM Student
  3  GROUP BY DepartmentID
  4  HAVING COUNT(*) = (
  5      SELECT MAX(cnt)
  6      FROM (
  7          SELECT COUNT(*) AS cnt
  8          FROM Student
  9          GROUP BY DepartmentID
 10      )
 11  );

DEPAR
-----
D101

SQL> SELECT Name
  2  FROM Student
  3  WHERE StudentID IN (
  4      SELECT StudentID
  5      FROM Enrollment
  6      WHERE CourseID IN (
  7          SELECT CourseID
  8          FROM Enrollment
  9          WHERE StudentID = 'S101'
 10      )
 11  );

NAME
--------------------------------------------------
Amit Kumar
Ravi Singh

SQL> SELECT Name
  2  FROM Student
  3  WHERE StudentID NOT IN (
  4      SELECT StudentID
  5      FROM Enrollment
  6  );

NAME
--------------------------------------------------
Pooja Sharma

SQL> SELECT CourseName
  2  FROM Course
  3  WHERE CourseID NOT IN (
  4      SELECT CourseID
  5      FROM Enrollment
  6  );

COURSENAME
--------------------------------------------------
Power System
Electronic
Advanced Hydrology
Operating System
DSA
Fluid mechanics

6 rows selected.

SQL>
